{"schema_name":"control-store-reinitialization-report","schema_version":"1.0.0","kernel_version":"2.0.0","operation_id":"reinitialize-00000000000000000000000000000000","snapshot_sha256":"aaaaaaaaaaaaaaaaaaaaaaaaaaaaaaaaaaaaaaaaaaaaaaaaaaaaaaaaaaaaaaaa","store_id":"bbbbbbbbbbbbbbbbbbbbbbbbbbbbbbbbbbbbbbbbbbbbbbbbbbbbbbbbbbbbbbbb","replacement_store_epoch":1,"final_global_status":"passed","identity_agreement":"passed","database_authority_agreement":"passed","filesystem_authority_agreement":"passed","output_binding_agreement":"passed","mutation_chain_agreement":"passed","projection_agreement":"passed","unresolved_ownership":[],"imported_authority":{"run_ids":[],"batch_ids":[],"nested_batch_run_ids":[],"batch_projection_ids":[],"delivery_run_ids":[],"table_row_counts":{}},"recorded_at":"2026-08-27T13:30:00+08:00"}
